wav_path|text|emb_id|style_target
/l/disk1/awstebas/data/TTS/vozes_sync/Rosana/9.1/rf_selecionadas/wav16/rf_selecionadas1810.wav|desde a antiguidade , os sonhos são encarados como presságios .|rosana|a_pool
/l/disk1/awstebas/data/TTS/vozes_sync/Rosana/9.1/rf_selecionadas/wav16/rf_selecionadas1252.wav|costumava jogar a culpa em oliveira , como os rebeldes .|rosana|a_pool
/l/disk1/awstebas/data/TTS/vozes_sync/Rosana/9.1/rf_selecionadas/wav16/rf_selecionadas0658.wav|usar também outro aplicativo , ou definir melhor os disponíveis .|rosana|a_pool
/l/disk1/awstebas/data/TTS/vozes_sync/Rosana/9.1/riqueza_fonetica/wav16/riqueza_fonetica0226.wav|pedi a devolução em dinheiro da quantia paga a mais .|rosana|a_pool
/l/disk1/awstebas/data/TTS/vozes_sync/Rosana/9.1/rf_selecionadas/wav16/rf_selecionadas1627.wav|no uruguai ele ainda dá palpite sobre a independência .|rosana|a_pool
/l/disk1/awstebas/data/TTS/vozes_sync/Rosana/9.1/rf_selecionadas/wav16/rf_selecionadas1455.wav|com um revólver do batalhão do guarujá na bolsa .|rosana|a_pool
/l/disk1/awstebas/data/TTS/vozes_sync/Rosana/9.1/rf_selecionadas/wav16/rf_selecionadas1178.wav|tinha em sua cabeça que , na última pesquisa , a novidade saiu de pauta .|rosana|a_pool
/l/disk1/awstebas/data/TTS/vozes_sync/Rosana/9.1/rf_selecionadas/wav16/rf_selecionadas0014.wav|pois o felipe massa é o dono da sua equipe .|rosana|a_pool
/l/disk1/awstebas/data/TTS/vozes_sync/Rosana/9.1/riqueza_fonetica/wav16/riqueza_fonetica0391.wav|tem mais chance de acertar quem disser todas as opções acima .|rosana|a_pool
/l/disk1/awstebas/data/TTS/vozes_sync/Rosana/9.1/rf_selecionadas/wav16/rf_selecionadas0608.wav|cardozo , com o que aconteceu , deixou o tribunal .|rosana|a_pool
/l/disk1/awstebas/data/TTS/vozes_sync/Rosana/9.1/riqueza_fonetica/wav16/riqueza_fonetica0323.wav|havia um jardim de inverno , sofás estampados e porta-retratos .|rosana|a_pool
/l/disk1/awstebas/data/TTS/vozes_sync/Rosana/9.1/rf_selecionadas/wav16/rf_selecionadas1741.wav|tem que ser fiscal durante a noite .|rosana|a_pool
/l/disk1/awstebas/data/TTS/vozes_sync/Rosana/9.1/riqueza_fonetica/wav16/riqueza_fonetica0186.wav|além do brasil , serão visitados china , formosa , argentina , panamá , paraguai e venezuela .|rosana|a_pool
/l/disk1/awstebas/data/TTS/vozes_sync/Rosana/9.1/rf_selecionadas/wav16/rf_selecionadas0490.wav|já era hora de darmos um basta nessa roubalheira .|rosana|a_pool
/l/disk1/awstebas/data/TTS/vozes_sync/Rosana/9.1/rf_selecionadas/wav16/rf_selecionadas0983.wav|exército egípcio nega que chamada antiterrorismo vise à irmandade .|rosana|a_pool
/l/disk1/awstebas/data/TTS/vozes_sync/Rosana/9.1/rf_selecionadas/wav16/rf_selecionadas1323.wav|uma pessoa que saiba o que dizer , segundo as novas regras .|rosana|a_pool
/l/disk1/awstebas/data/TTS/vozes_sync/Rosana/9.1/riqueza_fonetica/wav16/riqueza_fonetica0096.wav|quando as coisas não funcionam , o responsável é o chefe .|rosana|a_pool
/l/disk1/awstebas/data/TTS/vozes_sync/Rosana/9.1/rf_selecionadas/wav16/rf_selecionadas1254.wav|enquanto a doença mata as crianças da áfrica .|rosana|a_pool
/l/disk1/awstebas/data/TTS/vozes_sync/Rosana/9.1/riqueza_fonetica/wav16/riqueza_fonetica0427.wav|aqui eu tenho acesso a modernas técnicas de gerenciamento .|rosana|a_pool
/l/disk1/awstebas/data/TTS/vozes_sync/Rosana/9.1/rf_selecionadas/wav16/rf_selecionadas1368.wav|a carta de pero vaz de caminha é o principal registro histórico do descobrimento .|rosana|a_pool
/l/disk1/awstebas/data/TTS/vozes_sync/Rosana/9.1/rf_selecionadas/wav16/rf_selecionadas1113.wav|o ator da agência em real madrid , foi localizado .|rosana|a_pool
/l/disk1/awstebas/data/TTS/vozes_sync/Rosana/9.1/rf_selecionadas/wav16/rf_selecionadas0981.wav|os rebeldes da universidade decretaram situação de ocupação .|rosana|a_pool
/l/disk1/awstebas/data/TTS/vozes_sync/Rosana/9.1/rf_selecionadas/wav16/rf_selecionadas1047.wav|agenda do distrito federal , com café da tarde em estaleiro .|rosana|a_pool
/l/disk1/awstebas/data/TTS/vozes_sync/Rosana/9.1/rf_selecionadas/wav16/rf_selecionadas0456.wav|o papa esperava ser mais popular , mas ele cumpriu o mandato .|rosana|a_pool
/l/disk1/awstebas/data/TTS/vozes_sync/Rosana/9.1/rf_selecionadas/wav16/rf_selecionadas0460.wav|o rótulo da garrafa não informa a origem do rum .|rosana|a_pool
/l/disk1/awstebas/data/TTS/vozes_sync/Rosana/9.1/rf_selecionadas/wav16/rf_selecionadas0375.wav|a mensagem aos funcionários , aos poucos , vê toda a gente .|rosana|a_pool
/l/disk1/awstebas/data/TTS/vozes_sync/Rosana/9.1/rf_selecionadas/wav16/rf_selecionadas0440.wav|virar à esquerda no horto da paz .|rosana|a_pool
/l/disk1/awstebas/data/TTS/vozes_sync/Rosana/9.1/riqueza_fonetica/wav16/riqueza_fonetica0502.wav|o navio só não afundou porque a carga foi despejada no mar .|rosana|a_pool
/l/disk1/awstebas/data/TTS/vozes_sync/Rosana/9.1/riqueza_fonetica/wav16/riqueza_fonetica0256.wav|os primeiros sintomas são rosto inchado e voz rouca .|rosana|a_pool
/l/disk1/awstebas/data/TTS/vozes_sync/Rosana/9.1/riqueza_fonetica/wav16/riqueza_fonetica0105.wav|o estilista francês construiu o imóvel de seus sonhos .|rosana|a_pool
/l/disk1/awstebas/data/TTS/vozes_sync/Rosana/9.1/riqueza_fonetica/wav16/riqueza_fonetica0328.wav|jovens rebeldes empunhando fuzis e granadas impedem o acesso às montanhas .|rosana|a_pool
/l/disk1/awstebas/data/TTS/vozes_sync/Rosana/9.1/rf_selecionadas/wav16/rf_selecionadas0884.wav|fora da mata , eram milhas de caminho para rio doce .|rosana|a_pool
/l/disk1/awstebas/data/TTS/vozes_sync/Rosana/9.1/riqueza_fonetica/wav16/riqueza_fonetica0149.wav|não poderei tomar banho porque meu chuveiro está quebrado .|rosana|a_pool
/l/disk1/awstebas/data/TTS/vozes_sync/Rosana/9.1/rf_selecionadas/wav16/rf_selecionadas0535.wav|os recursos só foram acolhidos porque a legislação deixa brechas .|rosana|a_pool
/l/disk1/awstebas/data/TTS/vozes_sync/Rosana/9.1/riqueza_fonetica/wav16/riqueza_fonetica0003.wav|vários atletas tiveram um desempenho muito abaixo do esperado .|rosana|a_pool
/l/disk1/awstebas/data/TTS/vozes_sync/Rosana/9.1/rf_selecionadas/wav16/rf_selecionadas0472.wav|na madrugada de ontem , as discussões buscavam uma solução .|rosana|a_pool
/l/disk1/awstebas/data/TTS/vozes_sync/Rosana/9.1/rf_selecionadas/wav16/rf_selecionadas0873.wav|ela quer apaziguar os fatos , e denunciará o marido .|rosana|a_pool
/l/disk1/awstebas/data/TTS/vozes_sync/Rosana/9.1/rf_selecionadas/wav16/rf_selecionadas0871.wav|emissoras de tv tiveram que identificar seus mecanismos de funcionamento em um noticiário completo .|rosana|a_pool
/l/disk1/awstebas/data/TTS/vozes_sync/Rosana/9.1/riqueza_fonetica/wav16/riqueza_fonetica0004.wav|é a primeira vez que o nome do brasil \pa aparece nesta publicação .|rosana|a_pool
/l/disk1/awstebas/data/TTS/vozes_sync/Rosana/9.1/riqueza_fonetica/wav16/riqueza_fonetica0531.wav|veja se a caixa inclui a bula original .|rosana|a_pool
/l/disk1/awstebas/data/TTS/vozes_sync/Rosana/9.1/rf_selecionadas/wav16/rf_selecionadas0417.wav|a cesta básica traz o mínimo para as famílias dos funcionários .|rosana|a_pool
/l/disk1/awstebas/data/TTS/vozes_sync/Rosana/9.1/rf_selecionadas/wav16/rf_selecionadas0362.wav|foi preso pelo homicídio de roberto gurgel , acusou .|rosana|a_pool
/l/disk1/awstebas/data/TTS/vozes_sync/Rosana/9.1/rf_selecionadas/wav16/rf_selecionadas1374.wav|roubar sem barulho ou quadrilha .|rosana|a_pool
/l/disk1/awstebas/data/TTS/vozes_sync/Rosana/9.1/riqueza_fonetica/wav16/riqueza_fonetica0029.wav|as últimas análises \pa indicam crescimento nas vendas de eletrodomésticos importados .|rosana|a_pool
/l/disk1/awstebas/data/TTS/vozes_sync/Rosana/9.1/rf_selecionadas/wav16/rf_selecionadas0139.wav|centro de gerenciamento de futebol do clube espanhol .|rosana|a_pool
/l/disk1/awstebas/data/TTS/vozes_sync/Rosana/9.1/riqueza_fonetica/wav16/riqueza_fonetica0380.wav|procure em meu estojo um giz de cera vermelho .|rosana|a_pool
/l/disk1/awstebas/data/TTS/vozes_sync/Rosana/9.1/riqueza_fonetica/wav16/riqueza_fonetica0415.wav|a proximidade da data de inscrição aumenta a angústia dos candidatos .|rosana|a_pool
/l/disk1/awstebas/data/TTS/vozes_sync/Rosana/9.1/rf_selecionadas/wav16/rf_selecionadas0928.wav|não é a cúpula que prova as chances de gol .|rosana|a_pool
/l/disk1/awstebas/data/TTS/vozes_sync/Rosana/9.1/rf_selecionadas/wav16/rf_selecionadas0437.wav|fosse pela intriga da oposição , mantega não iria até o fim do mandato .|rosana|a_pool
/l/disk1/awstebas/data/TTS/vozes_sync/Rosana/9.1/rf_selecionadas/wav16/rf_selecionadas0737.wav|não demonstrem a expectativa dos casais .|rosana|a_pool
/l/disk1/awstebas/data/TTS/vozes_sync/Rosana/9.1/rf_selecionadas/wav16/rf_selecionadas0632.wav|o fogo no uruguai tem mais de uma hora .|rosana|a_pool
/l/disk1/awstebas/data/TTS/vozes_sync/Rosana/9.1/riqueza_fonetica/wav16/riqueza_fonetica0497.wav|o cantor usava roupas espalhafatosas , misturando roxo , rosa choque e laranja .|rosana|a_pool
/l/disk1/awstebas/data/TTS/vozes_sync/Rosana/9.1/rf_selecionadas/wav16/rf_selecionadas0564.wav|ele está em cada trabalho do canal .|rosana|a_pool
/l/disk1/awstebas/data/TTS/vozes_sync/Rosana/9.1/rf_selecionadas/wav16/rf_selecionadas0646.wav|fuga da mulher e de seus colegas para interlagos .|rosana|a_pool
/l/disk1/awstebas/data/TTS/vozes_sync/Rosana/9.1/rf_selecionadas/wav16/rf_selecionadas0546.wav|deste ano para cá , reserva euros para a viagem .|rosana|a_pool
/l/disk1/awstebas/data/TTS/vozes_sync/Rosana/9.1/rf_selecionadas/wav16/rf_selecionadas0816.wav|para o mercado de trabalho , vocês tem que se sobressair na entrevista coletiva .|rosana|a_pool
/l/disk1/awstebas/data/TTS/vozes_sync/Rosana/9.1/rf_selecionadas/wav16/rf_selecionadas1677.wav|caminhões que fazem a viagem , seguem o plano .|rosana|a_pool
/l/disk1/awstebas/data/TTS/vozes_sync/Rosana/9.1/rf_selecionadas/wav16/rf_selecionadas0069.wav|os documentos traziam a nota .|rosana|a_pool
/l/disk1/awstebas/data/TTS/vozes_sync/Rosana/9.1/rf_selecionadas/wav16/rf_selecionadas0702.wav|contá-las e vê-las escrituradas no livro caixa .|rosana|a_pool
/l/disk1/awstebas/data/TTS/vozes_sync/Rosana/9.1/rf_selecionadas/wav16/rf_selecionadas1352.wav|ela é dona de um sorriso radiante e encantador .|rosana|a_pool
/l/disk1/awstebas/data/TTS/vozes_sync/Rosana/9.1/rf_selecionadas/wav16/rf_selecionadas1882.wav|aqueles que gastam não terão mais esse direito .|rosana|a_pool
/l/disk1/awstebas/data/TTS/vozes_sync/Rosana/9.1/rf_selecionadas/wav16/rf_selecionadas0707.wav|fechar com a liminar da defesa .|rosana|a_pool
/l/disk1/awstebas/data/TTS/vozes_sync/Rosana/9.1/rf_selecionadas/wav16/rf_selecionadas1834.wav|o responsável pelos jogos , assim ele afirmou .|rosana|a_pool
/l/disk1/awstebas/data/TTS/vozes_sync/Rosana/9.1/rf_selecionadas/wav16/rf_selecionadas0579.wav|país com um pouco mais de política externa , diz o especialista .|rosana|a_pool
/l/disk1/awstebas/data/TTS/vozes_sync/Rosana/9.1/rf_selecionadas/wav16/rf_selecionadas0423.wav|a sobremesa era um doce de ameixa em calda .|rosana|a_pool
/l/disk1/awstebas/data/TTS/vozes_sync/Rosana/9.1/rf_selecionadas/wav16/rf_selecionadas1918.wav|usa alguns itens de incremento para o parque .|rosana|a_pool
/l/disk1/awstebas/data/TTS/vozes_sync/Rosana/9.1/riqueza_fonetica/wav16/riqueza_fonetica0235.wav|escolheu um terno bege e uma camisa escura .|rosana|a_pool
/l/disk1/awstebas/data/TTS/vozes_sync/Rosana/9.1/rf_selecionadas/wav16/rf_selecionadas1214.wav|assembléia geral da onu , em última análise , com urgência de tomar uma decisão .|rosana|a_pool
/l/disk1/awstebas/data/TTS/vozes_sync/Rosana/9.1/rf_selecionadas/wav16/rf_selecionadas0452.wav|choveu tanto que me molhei até o último fio de cabelo .|rosana|a_pool
/l/disk1/awstebas/data/TTS/vozes_sync/Rosana/9.1/riqueza_fonetica/wav16/riqueza_fonetica0547.wav|eu entrei num táxi e o condutor não me olhou .|rosana|a_pool
/l/disk1/awstebas/data/TTS/vozes_sync/Rosana/9.1/rf_selecionadas/wav16/rf_selecionadas1596.wav|a cadeira tem trama em junco e estrutura em madeira .|rosana|a_pool
/l/disk1/awstebas/data/TTS/vozes_sync/Rosana/9.1/rf_selecionadas/wav16/rf_selecionadas1211.wav|tinham somente até a terça para resolver sobre a greve .|rosana|a_pool
/l/disk1/awstebas/data/TTS/vozes_sync/Rosana/9.1/rf_selecionadas/wav16/rf_selecionadas0262.wav|iremos à turnê pela califórnia de qualquer jeito .|rosana|a_pool
/l/disk1/awstebas/data/TTS/vozes_sync/Rosana/9.1/rf_selecionadas/wav16/rf_selecionadas1648.wav|o único a contar foi o da silva .|rosana|a_pool
/l/disk1/awstebas/data/TTS/vozes_sync/Rosana/9.1/rf_selecionadas/wav16/rf_selecionadas0960.wav|não há razão para manipular um sinalizador .|rosana|a_pool
/l/disk1/awstebas/data/TTS/vozes_sync/Rosana/9.1/riqueza_fonetica/wav16/riqueza_fonetica0037.wav|é mais fácil conversar com pessoas que já conhecemos .|rosana|a_pool
/l/disk1/awstebas/data/TTS/vozes_sync/Rosana/9.1/rf_selecionadas/wav16/rf_selecionadas1951.wav|nas entrelinhas estão nossas regras para esta área .|rosana|a_pool
/l/disk1/awstebas/data/TTS/vozes_sync/Rosana/9.1/rf_selecionadas/wav16/rf_selecionadas0448.wav|vôos nos aeroportos geram reservas feitas na pressa .|rosana|a_pool
/l/disk1/awstebas/data/TTS/vozes_sync/Rosana/9.1/rf_selecionadas/wav16/rf_selecionadas1618.wav|nasceu no sul de paris , em mil novecentos e cinquenta e nove .|rosana|a_pool
/l/disk1/awstebas/data/TTS/vozes_sync/Rosana/9.1/rf_selecionadas/wav16/rf_selecionadas1234.wav|o município ganha , mas o bairro perde .|rosana|a_pool
/l/disk1/awstebas/data/TTS/vozes_sync/Rosana/9.1/rf_selecionadas/wav16/rf_selecionadas1975.wav|a visita às linhas começou na tarde de hoje .|rosana|a_pool
/l/disk1/awstebas/data/TTS/vozes_sync/Rosana/9.1/rf_selecionadas/wav16/rf_selecionadas0912.wav|forma de estudo não é boa para as avaliações .|rosana|a_pool
/l/disk1/awstebas/data/TTS/vozes_sync/Rosana/9.1/riqueza_fonetica/wav16/riqueza_fonetica0143.wav|a partida será disputada no estádio do morumbi e será apitada por um juiz sueco .|rosana|a_pool
/l/disk1/awstebas/data/TTS/vozes_sync/Rosana/9.1/riqueza_fonetica/wav16/riqueza_fonetica0129.wav|o orçamento inclui o projeto e o acompanhamento da obra .|rosana|a_pool
/l/disk1/awstebas/data/TTS/vozes_sync/Rosana/9.1/rf_selecionadas/wav16/rf_selecionadas0309.wav|peso bruto de toneladas por mês .|rosana|a_pool
/l/disk1/awstebas/data/TTS/vozes_sync/Rosana/9.1/rf_selecionadas/wav16/rf_selecionadas0703.wav|ele também critica hillary clinton .|rosana|a_pool
/l/disk1/awstebas/data/TTS/vozes_sync/Rosana/9.1/riqueza_fonetica/wav16/riqueza_fonetica0086.wav|ela tem a personalidade forte e é gaúcha .|rosana|a_pool
/l/disk1/awstebas/data/TTS/vozes_sync/Rosana/9.1/rf_selecionadas/wav16/rf_selecionadas1602.wav|lg , a vida é boa .|rosana|a_pool
/l/disk1/awstebas/data/TTS/vozes_sync/Rosana/9.1/rf_selecionadas/wav16/rf_selecionadas1466.wav|serão imóveis na ucrânia ou naquela região .|rosana|a_pool
/l/disk1/awstebas/data/TTS/vozes_sync/Rosana/9.1/riqueza_fonetica/wav16/riqueza_fonetica0377.wav|para pescar você só precisa de vara , linha , anzol e chumbada .|rosana|a_pool
/l/disk1/awstebas/data/TTS/vozes_sync/Rosana/9.1/rf_selecionadas/wav16/rf_selecionadas1389.wav|do paraguai pra baixo , vamos pelo caminho .|rosana|a_pool
/l/disk1/awstebas/data/TTS/vozes_sync/Rosana/9.1/rf_selecionadas/wav16/rf_selecionadas1313.wav|anterior ao crime , parece não saber se pode voltar .|rosana|a_pool
/l/disk1/awstebas/data/TTS/vozes_sync/Rosana/9.1/rf_selecionadas/wav16/rf_selecionadas1110.wav|maior pedregulho bruto da história , caído .|rosana|a_pool
/l/disk1/awstebas/data/TTS/vozes_sync/Rosana/9.1/rf_selecionadas/wav16/rf_selecionadas0876.wav|a vila tinha hospitais com esse dirigente .|rosana|a_pool
/l/disk1/awstebas/data/TTS/vozes_sync/Rosana/9.1/rf_selecionadas/wav16/rf_selecionadas0552.wav|são as filas de antiontem na venezuela .|rosana|a_pool
/l/disk1/awstebas/data/TTS/vozes_sync/Rosana/9.1/rf_selecionadas/wav16/rf_selecionadas1858.wav|assista ao vídeo em 4 ká por tempo indeterminado .|rosana|a_pool
/l/disk1/awstebas/data/TTS/vozes_sync/Rosana/9.1/riqueza_fonetica/wav16/riqueza_fonetica0278.wav|a troca de dados é feita pelos computadores das universidades .|rosana|a_pool
/l/disk1/awstebas/data/TTS/vozes_sync/Rosana/9.1/rf_selecionadas/wav16/rf_selecionadas0127.wav|muito popular , barbosa venceu o patamar da pesquisa .|rosana|a_pool
/l/disk1/awstebas/data/TTS/vozes_sync/Rosana/9.1/rf_selecionadas/wav16/rf_selecionadas1001.wav|quem tem a renda da ong britânica .|rosana|a_pool
/l/disk1/awstebas/data/TTS/vozes_sync/Rosana/9.1/rf_selecionadas/wav16/rf_selecionadas1045.wav|uma empresa enviou a juíza espanhola .|rosana|a_pool
/l/disk1/awstebas/data/TTS/vozes_sync/Rosana/9.1/rf_selecionadas/wav16/rf_selecionadas0818.wav|já tinha toda a tela em seu site oficial .|rosana|a_pool
/l/disk1/awstebas/data/TTS/vozes_sync/Rosana/9.1/rf_selecionadas/wav16/rf_selecionadas0481.wav|vi porque o crédito afetará até o posto de gasolina .|rosana|a_pool
/l/disk1/awstebas/data/TTS/vozes_sync/Rosana/9.1/riqueza_fonetica/wav16/riqueza_fonetica0067.wav|o artista projetou chapéus e jóias a partir de suas pinturas .|rosana|a_pool
/l/disk1/awstebas/data/TTS/vozes_sync/Rosana/9.1/rf_selecionadas/wav16/rf_selecionadas0071.wav|um plenário avaliou as opções do preso no sábado .|rosana|a_pool
/l/disk1/awstebas/data/TTS/vozes_sync/Rosana/9.1/rf_selecionadas/wav16/rf_selecionadas1034.wav|para pagar pelo menos uma personagem na primeira fase .|rosana|a_pool
/l/disk1/awstebas/data/TTS/vozes_sync/Rosana/9.1/rf_selecionadas/wav16/rf_selecionadas0315.wav|i p c á e o lado negro da instituição .|rosana|a_pool
/l/disk1/awstebas/data/TTS/vozes_sync/Rosana/9.1/rf_selecionadas/wav16/rf_selecionadas0861.wav|preencherem as vagas que haviam sumido da televisão .|rosana|a_pool
/l/disk1/awstebas/data/TTS/vozes_sync/Rosana/9.1/riqueza_fonetica/wav16/riqueza_fonetica0540.wav|é um bebê saudável , corado e bochechudo .|rosana|a_pool
/l/disk1/awstebas/data/TTS/vozes_sync/Rosana/9.1/rf_selecionadas/wav16/rf_selecionadas0196.wav|completou o vídeo da aplicação do óleo no motor do carro .|rosana|a_pool
/l/disk1/awstebas/data/TTS/vozes_sync/Rosana/9.1/rf_selecionadas/wav16/rf_selecionadas0036.wav|abrir o placar na vila belmiro .|rosana|a_pool
/l/disk1/awstebas/data/TTS/vozes_sync/Rosana/9.1/rf_selecionadas/wav16/rf_selecionadas1966.wav|necessidade de ter ordem acima de tudo o mais , visando ao acordo .|rosana|a_pool
/l/disk1/awstebas/data/TTS/vozes_sync/Rosana/9.1/riqueza_fonetica/wav16/riqueza_fonetica0524.wav|sempre brinca com o bordão que o popularizou atualmente .|rosana|a_pool
/l/disk1/awstebas/data/TTS/vozes_sync/Rosana/9.1/riqueza_fonetica/wav16/riqueza_fonetica0211.wav|foi um choque estranho quando ele engoliu tudo aquilo .|rosana|a_pool
/l/disk1/awstebas/data/TTS/vozes_sync/Rosana/9.1/riqueza_fonetica/wav16/riqueza_fonetica0016.wav|o suave perfume das gardênias \pa é a principal característica do jardim central .|rosana|a_pool
/l/disk1/awstebas/data/TTS/vozes_sync/Rosana/9.1/rf_selecionadas/wav16/rf_selecionadas1970.wav|em itapecerica da serra , ele sentiu a oposição .|rosana|a_pool
/l/disk1/awstebas/data/TTS/vozes_sync/Rosana/9.1/rf_selecionadas/wav16/rf_selecionadas0728.wav|modo como os alunos me perguntam pela falta de provas .|rosana|a_pool
/l/disk1/awstebas/data/TTS/vozes_sync/Rosana/9.1/rf_selecionadas/wav16/rf_selecionadas0334.wav|o último sorteio que ficou acumulado .|rosana|a_pool
/l/disk1/awstebas/data/TTS/vozes_sync/Rosana/9.1/rf_selecionadas/wav16/rf_selecionadas0964.wav|geraldo álckmin , sobretudo , pede contra tomar um gol no morumbi .|rosana|a_pool
/l/disk1/awstebas/data/TTS/vozes_sync/Rosana/9.1/rf_selecionadas/wav16/rf_selecionadas1545.wav|o homem comeu de tudo , inclusive o chucrute .|rosana|a_pool
/l/disk1/awstebas/data/TTS/vozes_sync/Rosana/9.1/rf_selecionadas/wav16/rf_selecionadas1835.wav|até o uso de drogas mudou por ter sido preso .|rosana|a_pool
/l/disk1/awstebas/data/TTS/vozes_sync/Rosana/9.1/rf_selecionadas/wav16/rf_selecionadas0603.wav|imagine os abusos durante a abertura da copa .|rosana|a_pool
/l/disk1/awstebas/data/TTS/vozes_sync/Rosana/9.1/rf_selecionadas/wav16/rf_selecionadas0017.wav|só a turquia paga pelas campanhas a favor de moscou .|rosana|a_pool
/l/disk1/awstebas/data/TTS/vozes_sync/Rosana/9.1/rf_selecionadas/wav16/rf_selecionadas1855.wav|a parte do livro é a que fala da rivalidade da espanha .|rosana|a_pool
/l/disk1/awstebas/data/TTS/vozes_sync/Rosana/9.1/rf_selecionadas/wav16/rf_selecionadas0040.wav|diego corre para mim , e larga você .|rosana|a_pool
/l/disk1/awstebas/data/TTS/vozes_sync/Rosana/9.1/rf_selecionadas/wav16/rf_selecionadas1221.wav|joaquim barbosa não quis se pronunciar .|rosana|a_pool
/l/disk1/awstebas/data/TTS/vozes_sync/Rosana/9.1/riqueza_fonetica/wav16/riqueza_fonetica0493.wav|não jantei , mas comi um misto quente no fim da tarde .|rosana|a_pool
/l/disk1/awstebas/data/TTS/vozes_sync/Rosana/9.1/rf_selecionadas/wav16/rf_selecionadas1052.wav|não há dúvida , o povo é organizado , cuidam do que está à sua volta .|rosana|a_pool
/l/disk1/awstebas/data/TTS/vozes_sync/Rosana/9.1/rf_selecionadas/wav16/rf_selecionadas0365.wav|o trânsito nos túneis foi desviado , provocando um congestionamento de quinze quilômetros .|rosana|a_pool
/l/disk1/awstebas/data/TTS/vozes_sync/Rosana/9.1/rf_selecionadas/wav16/rf_selecionadas1369.wav|a reforma econômica da china melhorou profundamente a gestão das empresas .|rosana|a_pool
/l/disk1/awstebas/data/TTS/vozes_sync/Rosana/9.1/rf_selecionadas/wav16/rf_selecionadas1063.wav|para o setor elétrico , a onu não informou a nacionalidade .|rosana|a_pool
/l/disk1/awstebas/data/TTS/vozes_sync/Rosana/9.1/rf_selecionadas/wav16/rf_selecionadas1783.wav|mais fácil o artista deixar o festival , do que proteger sua mulher .|rosana|a_pool
/l/disk1/awstebas/data/TTS/vozes_sync/Rosana/9.1/rf_selecionadas/wav16/rf_selecionadas0525.wav|siga o twítter pelo facebook .|rosana|a_pool
/l/disk1/awstebas/data/TTS/vozes_sync/Rosana/9.1/rf_selecionadas/wav16/rf_selecionadas1204.wav|no aeroporto do galeão , solo negro passará por análise de origem .|rosana|a_pool
/l/disk1/awstebas/data/TTS/vozes_sync/Rosana/9.1/rf_selecionadas/wav16/rf_selecionadas0705.wav|nós tomamos um caminho que nos levou a dizer isso .|rosana|a_pool
/l/disk1/awstebas/data/TTS/vozes_sync/Rosana/9.1/riqueza_fonetica/wav16/riqueza_fonetica0321.wav|foi para o xadrez porque passou cheque sem fundo .|rosana|a_pool
/l/disk1/awstebas/data/TTS/vozes_sync/Rosana/9.1/rf_selecionadas/wav16/rf_selecionadas0736.wav|siga o farol em silêncio .|rosana|a_pool
/l/disk1/awstebas/data/TTS/vozes_sync/Rosana/9.1/rf_selecionadas/wav16/rf_selecionadas1008.wav|essa é a engenharia do jogo , berrou .|rosana|a_pool
/l/disk1/awstebas/data/TTS/vozes_sync/Rosana/9.1/rf_selecionadas/wav16/rf_selecionadas0783.wav|provocou os amigos e os chamou para conversar .|rosana|a_pool
/l/disk1/awstebas/data/TTS/vozes_sync/Rosana/9.1/rf_selecionadas/wav16/rf_selecionadas1937.wav|é uma obra vistosa , na parte baixa da vila .|rosana|a_pool
/l/disk1/awstebas/data/TTS/vozes_sync/Rosana/9.1/riqueza_fonetica/wav16/riqueza_fonetica0201.wav|a qualidade deixa a desejar em alguns estados .|rosana|a_pool
/l/disk1/awstebas/data/TTS/vozes_sync/Rosana/9.1/rf_selecionadas/wav16/rf_selecionadas1056.wav|hoje vou aos troféus que o goleiro estrangeiro ganhou .|rosana|a_pool
/l/disk1/awstebas/data/TTS/vozes_sync/Rosana/9.1/riqueza_fonetica/wav16/riqueza_fonetica0436.wav|chove forte em toda a baixada fluminense .|rosana|a_pool
/l/disk1/awstebas/data/TTS/vozes_sync/Rosana/9.1/riqueza_fonetica/wav16/riqueza_fonetica0259.wav|a sujeira entrava por um furo no teto do quarto .|rosana|a_pool
/l/disk1/awstebas/data/TTS/vozes_sync/Rosana/9.1/rf_selecionadas/wav16/rf_selecionadas0159.wav|essa biblioteca não chega nem aos pés da que eu visitei .|rosana|a_pool
/l/disk1/awstebas/data/TTS/vozes_sync/Rosana/9.1/rf_selecionadas/wav16/rf_selecionadas1240.wav|do amazonas , sobre o tema , escreveu às famílias das ribeirinhas .|rosana|a_pool
/l/disk1/awstebas/data/TTS/vozes_sync/Rosana/9.1/rf_selecionadas/wav16/rf_selecionadas0891.wav|tarifa fica mais cara nos próximos dias , pois o cinema era original .|rosana|a_pool
/l/disk1/awstebas/data/TTS/vozes_sync/Rosana/9.1/riqueza_fonetica/wav16/riqueza_fonetica0092.wav|foi mostrado o que há de melhor em moda feminina .|rosana|a_pool
/l/disk1/awstebas/data/TTS/vozes_sync/Rosana/9.1/rf_selecionadas/wav16/rf_selecionadas1820.wav|vai ser com ele que irá até a emissora de rádio e televisão .|rosana|a_pool
/l/disk1/awstebas/data/TTS/vozes_sync/Rosana/9.1/rf_selecionadas/wav16/rf_selecionadas1875.wav|animais são a razão para se conservar o meio .|rosana|a_pool
/l/disk1/awstebas/data/TTS/vozes_sync/Rosana/9.1/riqueza_fonetica/wav16/riqueza_fonetica0099.wav|entrou no cinema com o revólver em punho e disparou dois tiros .|rosana|a_pool
/l/disk1/awstebas/data/TTS/vozes_sync/Rosana/9.1/riqueza_fonetica/wav16/riqueza_fonetica0440.wav|cortaram um enorme jequitibá com a serra elétrica .|rosana|a_pool
/l/disk1/awstebas/data/TTS/vozes_sync/Rosana/9.1/rf_selecionadas/wav16/rf_selecionadas1064.wav|na cadeia não dá para saber se está tudo bem .|rosana|a_pool
/l/disk1/awstebas/data/TTS/vozes_sync/Rosana/9.1/rf_selecionadas/wav16/rf_selecionadas0836.wav|o destino da pontifícia universidade católica eu não sei .|rosana|a_pool
/l/disk1/awstebas/data/TTS/vozes_sync/Rosana/9.1/rf_selecionadas/wav16/rf_selecionadas1425.wav|cada um dizendo enfrentar a doença de modo individual .|rosana|a_pool
/l/disk1/awstebas/data/TTS/vozes_sync/Rosana/9.1/riqueza_fonetica/wav16/riqueza_fonetica0038.wav|para ganharmos o jogo , é fundamental dominar o meio de campo com frieza .|rosana|a_pool
/l/disk1/awstebas/data/TTS/vozes_sync/Rosana/9.1/rf_selecionadas/wav16/rf_selecionadas0024.wav|foi um ato covarde , mas ocuparam .|rosana|a_pool
