wav_path|text|emb_id|style_target
/l/disk1/awstebas/data/TTS/vozes_sync/Rosana/9.1/riqueza_fonetica/wav16/riqueza_fonetica0358.wav|o movimento ganhou apoio da população e de alguns ex-aliados políticos do governo .|rosana|a_pool
/l/disk1/awstebas/data/TTS/vozes_sync/Rosana/9.1/riqueza_fonetica/wav16/riqueza_fonetica0429.wav|as duas instituições bancárias não recorreram das decisões judiciais .|rosana|a_pool
/l/disk1/awstebas/data/TTS/vozes_sync/Rosana/9.1/rf_selecionadas/wav16/rf_selecionadas1301.wav|o idoso senhor acha que o sucesso que tem deve-se à música que fez .|rosana|a_pool
/l/disk1/awstebas/data/TTS/vozes_sync/Rosana/9.1/rf_selecionadas/wav16/rf_selecionadas0105.wav|a doença é uma ameaça ao nordeste .|rosana|a_pool
/l/disk1/awstebas/data/TTS/vozes_sync/Rosana/9.1/rf_selecionadas/wav16/rf_selecionadas0805.wav|quer se reeleger sem conhecer nenhum bairro pobre da cidade .|rosana|a_pool
/l/disk1/awstebas/data/TTS/vozes_sync/Rosana/9.1/rf_selecionadas/wav16/rf_selecionadas0903.wav|gilberto kassab na embaixada de curitiba .|rosana|a_pool
/l/disk1/awstebas/data/TTS/vozes_sync/Rosana/9.1/rf_selecionadas/wav16/rf_selecionadas1060.wav|no fim da linha do trem encontramos o grande açude .|rosana|a_pool
/l/disk1/awstebas/data/TTS/vozes_sync/Rosana/9.1/rf_selecionadas/wav16/rf_selecionadas1903.wav|que seu apoio tenha valor em qualquer lugar do mundo .|rosana|a_pool
/l/disk1/awstebas/data/TTS/vozes_sync/Rosana/9.1/rf_selecionadas/wav16/rf_selecionadas1450.wav|madri derrota por um a zero o time de curitiba .|rosana|a_pool
/l/disk1/awstebas/data/TTS/vozes_sync/Rosana/9.1/rf_selecionadas/wav16/rf_selecionadas1220.wav|claro que a multinacional não pega na argentina .|rosana|a_pool
/l/disk1/awstebas/data/TTS/vozes_sync/Rosana/9.1/rf_selecionadas/wav16/rf_selecionadas1914.wav|mantenham a escolha , é forma de protesto .|rosana|a_pool
/l/disk1/awstebas/data/TTS/vozes_sync/Rosana/9.1/rf_selecionadas/wav16/rf_selecionadas0942.wav|do dia do sorteio até por volta das 17h .|rosana|a_pool
/l/disk1/awstebas/data/TTS/vozes_sync/Rosana/9.1/riqueza_fonetica/wav16/riqueza_fonetica0340.wav|nossa clientela é formada por senhoras interessadas em revender as mercadorias .|rosana|a_pool
/l/disk1/awstebas/data/TTS/vozes_sync/Rosana/9.1/rf_selecionadas/wav16/rf_selecionadas1781.wav|é a maior compania da refinaria .|rosana|a_pool
/l/disk1/awstebas/data/TTS/vozes_sync/Rosana/9.1/rf_selecionadas/wav16/rf_selecionadas0890.wav|deu cabo da água das chuvas , no fundo de redes .|rosana|a_pool
/l/disk1/awstebas/data/TTS/vozes_sync/Rosana/9.1/rf_selecionadas/wav16/rf_selecionadas0577.wav|um projeto vai analisar o impacto da tecnologia em zonas rurais .|rosana|a_pool
/l/disk1/awstebas/data/TTS/vozes_sync/Rosana/9.1/rf_selecionadas/wav16/rf_selecionadas0382.wav|o painel mostra para nós , em táblets e celulares .|rosana|a_pool
/l/disk1/awstebas/data/TTS/vozes_sync/Rosana/9.1/rf_selecionadas/wav16/rf_selecionadas0420.wav|idosos se utilizam da banda larga livre .|rosana|a_pool
/l/disk1/awstebas/data/TTS/vozes_sync/Rosana/9.1/riqueza_fonetica/wav16/riqueza_fonetica0462.wav|foi levada da américa e achada na ásia e europa .|rosana|a_pool
/l/disk1/awstebas/data/TTS/vozes_sync/Rosana/9.1/rf_selecionadas/wav16/rf_selecionadas0293.wav|o socorro ao regime sírio é normal .|rosana|a_pool
/l/disk1/awstebas/data/TTS/vozes_sync/Rosana/9.1/riqueza_fonetica/wav16/riqueza_fonetica0088.wav|o índio olhou revoltado a horda que invadia o xingu .|rosana|a_pool
/l/disk1/awstebas/data/TTS/vozes_sync/Rosana/9.1/rf_selecionadas/wav16/rf_selecionadas0691.wav|a chuva terminou sendo menor que na baixada fluminense .|rosana|a_pool
/l/disk1/awstebas/data/TTS/vozes_sync/Rosana/9.1/rf_selecionadas/wav16/rf_selecionadas0384.wav|opinou sobre o chefe da república dos outros países .|rosana|a_pool
/l/disk1/awstebas/data/TTS/vozes_sync/Rosana/9.1/rf_selecionadas/wav16/rf_selecionadas0731.wav|a um passo da homenagem com a nação alviverde .|rosana|a_pool
/l/disk1/awstebas/data/TTS/vozes_sync/Rosana/9.1/rf_selecionadas/wav16/rf_selecionadas0995.wav|a aplicação da droga em jejum pode provocar enjôo no paciente .|rosana|a_pool
/l/disk1/awstebas/data/TTS/vozes_sync/Rosana/9.1/rf_selecionadas/wav16/rf_selecionadas0764.wav|a evolução da moda reflete uma sequência de episódios recentes de nosso cotidiano .|rosana|a_pool
/l/disk1/awstebas/data/TTS/vozes_sync/Rosana/9.1/rf_selecionadas/wav16/rf_selecionadas0345.wav|pizzolato quebra em um ano , e austrália acusa hackers chineses .|rosana|a_pool
/l/disk1/awstebas/data/TTS/vozes_sync/Rosana/9.1/rf_selecionadas/wav16/rf_selecionadas0162.wav|a idéia é a de refletir as roupas da corte .|rosana|a_pool
/l/disk1/awstebas/data/TTS/vozes_sync/Rosana/9.1/rf_selecionadas/wav16/rf_selecionadas1768.wav|é prioridade a interpretação das contas externas .|rosana|a_pool
/l/disk1/awstebas/data/TTS/vozes_sync/Rosana/9.1/riqueza_fonetica/wav16/riqueza_fonetica0542.wav|as inscrições serão abertas hoje à tarde .|rosana|a_pool
/l/disk1/awstebas/data/TTS/vozes_sync/Rosana/9.1/rf_selecionadas/wav16/rf_selecionadas1954.wav|graças ao barbeiro , podemos ampliar a regulamentação na região central .|rosana|a_pool
/l/disk1/awstebas/data/TTS/vozes_sync/Rosana/9.1/riqueza_fonetica/wav16/riqueza_fonetica0430.wav|as mensagens de erro explicarão melhor qual é o problema .|rosana|a_pool
/l/disk1/awstebas/data/TTS/vozes_sync/Rosana/9.1/rf_selecionadas/wav16/rf_selecionadas1607.wav|olhar jorge na gestão tem sido o melhor , acrescentou .|rosana|a_pool
/l/disk1/awstebas/data/TTS/vozes_sync/Rosana/9.1/riqueza_fonetica/wav16/riqueza_fonetica0197.wav|arremessou a xícara velha , que se chocou contra o muro .|rosana|a_pool
/l/disk1/awstebas/data/TTS/vozes_sync/Rosana/9.1/rf_selecionadas/wav16/rf_selecionadas0767.wav|assistiu a um jogo de capoeira .|rosana|a_pool
/l/disk1/awstebas/data/TTS/vozes_sync/Rosana/9.1/rf_selecionadas/wav16/rf_selecionadas0765.wav|bebeu , não jantou bem , e amanheceu de ressaca .|rosana|a_pool
/l/disk1/awstebas/data/TTS/vozes_sync/Rosana/9.1/rf_selecionadas/wav16/rf_selecionadas0926.wav|mas sem o furo que atingiu o nível mais baixo .|rosana|a_pool
/l/disk1/awstebas/data/TTS/vozes_sync/Rosana/9.1/rf_selecionadas/wav16/rf_selecionadas0723.wav|morreu no horizonte com um tiro na cabeça .|rosana|a_pool
/l/disk1/awstebas/data/TTS/vozes_sync/Rosana/9.1/rf_selecionadas/wav16/rf_selecionadas1920.wav|nunca use o cheque especial para pagar dívidas decorrentes de outros financiamentos .|rosana|a_pool
/l/disk1/awstebas/data/TTS/vozes_sync/Rosana/9.1/rf_selecionadas/wav16/rf_selecionadas0486.wav|joão diz que , em curitiba , obteve os mísseis do ataque .|rosana|a_pool
/l/disk1/awstebas/data/TTS/vozes_sync/Rosana/9.1/rf_selecionadas/wav16/rf_selecionadas1926.wav|ele tem dez dias de liberdade por verão .|rosana|a_pool
/l/disk1/awstebas/data/TTS/vozes_sync/Rosana/9.1/rf_selecionadas/wav16/rf_selecionadas0210.wav|tais notícias chegam apenas àqueles que têm acesso à internet .|rosana|a_pool
/l/disk1/awstebas/data/TTS/vozes_sync/Rosana/9.1/rf_selecionadas/wav16/rf_selecionadas0696.wav|a filha do presidente do clube ganhou o concurso de miss .|rosana|a_pool
/l/disk1/awstebas/data/TTS/vozes_sync/Rosana/9.1/rf_selecionadas/wav16/rf_selecionadas0585.wav|quem não fez nada não é nosso único compromisso .|rosana|a_pool
/l/disk1/awstebas/data/TTS/vozes_sync/Rosana/9.1/rf_selecionadas/wav16/rf_selecionadas0381.wav|a cerâmica produz telhas e tijolos furados .|rosana|a_pool
/l/disk1/awstebas/data/TTS/vozes_sync/Rosana/9.1/rf_selecionadas/wav16/rf_selecionadas0095.wav|com a gravidez da esposa , os cuidados e os carinhos redobraram .|rosana|a_pool
/l/disk1/awstebas/data/TTS/vozes_sync/Rosana/9.1/rf_selecionadas/wav16/rf_selecionadas0370.wav|miguel tem um álbum com todos os pênaltis .|rosana|a_pool
/l/disk1/awstebas/data/TTS/vozes_sync/Rosana/9.1/rf_selecionadas/wav16/rf_selecionadas0053.wav|a violência atingiu os atletas do futebol .|rosana|a_pool
/l/disk1/awstebas/data/TTS/vozes_sync/Rosana/9.1/rf_selecionadas/wav16/rf_selecionadas0793.wav|ele é sonhador e alheio à realidade .|rosana|a_pool
/l/disk1/awstebas/data/TTS/vozes_sync/Rosana/9.1/rf_selecionadas/wav16/rf_selecionadas1682.wav|adicione mais ruído a essa barulheira toda .|rosana|a_pool
/l/disk1/awstebas/data/TTS/vozes_sync/Rosana/9.1/riqueza_fonetica/wav16/riqueza_fonetica0335.wav|nada como um bom vinho de caxias do sul para uma noite de inverno .|rosana|a_pool
/l/disk1/awstebas/data/TTS/vozes_sync/Rosana/9.1/riqueza_fonetica/wav16/riqueza_fonetica0158.wav|as fãs o chamam carinhosamente de belezura .|rosana|a_pool
/l/disk1/awstebas/data/TTS/vozes_sync/Rosana/9.1/rf_selecionadas/wav16/rf_selecionadas1961.wav|só a assessoria de imprensa anterior .|rosana|a_pool
/l/disk1/awstebas/data/TTS/vozes_sync/Rosana/9.1/rf_selecionadas/wav16/rf_selecionadas0415.wav|tem a lula na praia de buenos aires .|rosana|a_pool
/l/disk1/awstebas/data/TTS/vozes_sync/Rosana/9.1/rf_selecionadas/wav16/rf_selecionadas1873.wav|direito a voto no reajuste estadual .|rosana|a_pool
/l/disk1/awstebas/data/TTS/vozes_sync/Rosana/9.1/riqueza_fonetica/wav16/riqueza_fonetica0084.wav|depois de sonhos e ilusões , o primeiro contato com a faculdade costuma ser um choque .|rosana|a_pool
/l/disk1/awstebas/data/TTS/vozes_sync/Rosana/9.1/rf_selecionadas/wav16/rf_selecionadas1959.wav|disse que não tinha a intenção de deixar a sua conta no banco .|rosana|a_pool
/l/disk1/awstebas/data/TTS/vozes_sync/Rosana/9.1/rf_selecionadas/wav16/rf_selecionadas1823.wav|em um comunicado que não leva a um acordo .|rosana|a_pool
/l/disk1/awstebas/data/TTS/vozes_sync/Rosana/9.1/rf_selecionadas/wav16/rf_selecionadas1863.wav|negocia royalties do petróleo , nas regiões próximas à turquia .|rosana|a_pool
/l/disk1/awstebas/data/TTS/vozes_sync/Rosana/9.1/rf_selecionadas/wav16/rf_selecionadas0760.wav|a china passa por um consultor com essa idéia .|rosana|a_pool
/l/disk1/awstebas/data/TTS/vozes_sync/Rosana/9.1/rf_selecionadas/wav16/rf_selecionadas0711.wav|serviram alguns salgadinhos e chá de hortelã .|rosana|a_pool
/l/disk1/awstebas/data/TTS/vozes_sync/Rosana/9.1/riqueza_fonetica/wav16/riqueza_fonetica0401.wav|é recomendável o uso de capas impermeáveis para visitar a cachoeira .|rosana|a_pool
/l/disk1/awstebas/data/TTS/vozes_sync/Rosana/9.1/rf_selecionadas/wav16/rf_selecionadas0339.wav|abrir o gabinete e encontrar o pedido .|rosana|a_pool
/l/disk1/awstebas/data/TTS/vozes_sync/Rosana/9.1/rf_selecionadas/wav16/rf_selecionadas1908.wav|em 2008 , a estimativa é que muita gente agüentou .|rosana|a_pool
/l/disk1/awstebas/data/TTS/vozes_sync/Rosana/9.1/riqueza_fonetica/wav16/riqueza_fonetica0416.wav|a quantidade de espécies de plantas na amazônia \pa é inesgotável .|rosana|a_pool
/l/disk1/awstebas/data/TTS/vozes_sync/Rosana/9.1/rf_selecionadas/wav16/rf_selecionadas0228.wav|era um velhote simpático , que tocava guitarra e adorava surfe .|rosana|a_pool
/l/disk1/awstebas/data/TTS/vozes_sync/Rosana/9.1/rf_selecionadas/wav16/rf_selecionadas1658.wav|o presidente jurou governar com uma mão enquanto a outra folheia a constituição .|rosana|a_pool
/l/disk1/awstebas/data/TTS/vozes_sync/Rosana/9.1/riqueza_fonetica/wav16/riqueza_fonetica0151.wav|nesse ponto não há discussão nem barganha .|rosana|a_pool
/l/disk1/awstebas/data/TTS/vozes_sync/Rosana/9.1/riqueza_fonetica/wav16/riqueza_fonetica0061.wav|a agulha de chumbo é perigosa apenas se não for usada com cuidado .|rosana|a_pool
/l/disk1/awstebas/data/TTS/vozes_sync/Rosana/9.1/rf_selecionadas/wav16/rf_selecionadas1571.wav|aos bérros , tentava incentivar o time a lutar até o fim do jogo .|rosana|a_pool
/l/disk1/awstebas/data/TTS/vozes_sync/Rosana/9.1/rf_selecionadas/wav16/rf_selecionadas1181.wav|com que os réus têm certeza do risco .|rosana|a_pool
/l/disk1/awstebas/data/TTS/vozes_sync/Rosana/9.1/rf_selecionadas/wav16/rf_selecionadas0356.wav|o que vai acontecer , no segundo bloco , na novela francesa .|rosana|a_pool
/l/disk1/awstebas/data/TTS/vozes_sync/Rosana/9.1/rf_selecionadas/wav16/rf_selecionadas0314.wav|uma linha de montadoras se fixou no leste europeu .|rosana|a_pool
/l/disk1/awstebas/data/TTS/vozes_sync/Rosana/9.1/rf_selecionadas/wav16/rf_selecionadas1963.wav|é bom a gente se mexer antes que seja tarde demais para tentar algo .|rosana|a_pool
/l/disk1/awstebas/data/TTS/vozes_sync/Rosana/9.1/rf_selecionadas/wav16/rf_selecionadas1843.wav|continuo fazendo meu trabalho como eu entendo .|rosana|a_pool
/l/disk1/awstebas/data/TTS/vozes_sync/Rosana/9.1/rf_selecionadas/wav16/rf_selecionadas1685.wav|acho esta mostra melhor que a seguinte .|rosana|a_pool
/l/disk1/awstebas/data/TTS/vozes_sync/Rosana/9.1/rf_selecionadas/wav16/rf_selecionadas0803.wav|a compania de engenharia de tráfego usa alguns itens ilegais .|rosana|a_pool
/l/disk1/awstebas/data/TTS/vozes_sync/Rosana/9.1/rf_selecionadas/wav16/rf_selecionadas0432.wav|já as portas na vila belmiro valem para os atletas .|rosana|a_pool
/l/disk1/awstebas/data/TTS/vozes_sync/Rosana/9.1/rf_selecionadas/wav16/rf_selecionadas0895.wav|sem reservas , lia sobre os recursos naturais .|rosana|a_pool
/l/disk1/awstebas/data/TTS/vozes_sync/Rosana/9.1/rf_selecionadas/wav16/rf_selecionadas1833.wav|joão cândido chegou logo a seguir , em segundo lugar .|rosana|a_pool
/l/disk1/awstebas/data/TTS/vozes_sync/Rosana/9.1/rf_selecionadas/wav16/rf_selecionadas0549.wav|vão na cerimônia que essa será no fim de ano .|rosana|a_pool
/l/disk1/awstebas/data/TTS/vozes_sync/Rosana/9.1/rf_selecionadas/wav16/rf_selecionadas1042.wav|ela me acordou com um beijo e me disse bom dia .|rosana|a_pool
/l/disk1/awstebas/data/TTS/vozes_sync/Rosana/9.1/rf_selecionadas/wav16/rf_selecionadas0511.wav|o balanço das bombas leva os europeus a hospitais da região .|rosana|a_pool
/l/disk1/awstebas/data/TTS/vozes_sync/Rosana/9.1/riqueza_fonetica/wav16/riqueza_fonetica0393.wav|todos querem ajudar a construir um mundo novo .|rosana|a_pool
/l/disk1/awstebas/data/TTS/vozes_sync/Rosana/9.1/rf_selecionadas/wav16/rf_selecionadas0611.wav|pedem a soltura da família e , se der , do criminoso .|rosana|a_pool
/l/disk1/awstebas/data/TTS/vozes_sync/Rosana/9.1/rf_selecionadas/wav16/rf_selecionadas0694.wav|neymar é do movimento estadual .|rosana|a_pool
/l/disk1/awstebas/data/TTS/vozes_sync/Rosana/9.1/rf_selecionadas/wav16/rf_selecionadas0775.wav|os bilhetes magnéticos já são usados no metrô \pa e em alguns museus .|rosana|a_pool
/l/disk1/awstebas/data/TTS/vozes_sync/Rosana/9.1/rf_selecionadas/wav16/rf_selecionadas1023.wav|o vasco volta atrás .|rosana|a_pool
/l/disk1/awstebas/data/TTS/vozes_sync/Rosana/9.1/riqueza_fonetica/wav16/riqueza_fonetica0144.wav|o carro tem direção hidráulica , tipo pinhão e cremalheira .|rosana|a_pool
/l/disk1/awstebas/data/TTS/vozes_sync/Rosana/9.1/rf_selecionadas/wav16/rf_selecionadas1775.wav|foi o último livro escrito por joão cabral de melo neto .|rosana|a_pool
/l/disk1/awstebas/data/TTS/vozes_sync/Rosana/9.1/rf_selecionadas/wav16/rf_selecionadas0134.wav|lá na boca conseguirá mil unidades .|rosana|a_pool
/l/disk1/awstebas/data/TTS/vozes_sync/Rosana/9.1/rf_selecionadas/wav16/rf_selecionadas0653.wav|calor o suficiente para o sistema cantareira .|rosana|a_pool
/l/disk1/awstebas/data/TTS/vozes_sync/Rosana/9.1/rf_selecionadas/wav16/rf_selecionadas1002.wav|estamos todo mundo aguardando a aprovação .|rosana|a_pool
/l/disk1/awstebas/data/TTS/vozes_sync/Rosana/9.1/riqueza_fonetica/wav16/riqueza_fonetica0411.wav|a prefeitura gasta 65 por cento da receita só com a folha de pagamento .|rosana|a_pool
/l/disk1/awstebas/data/TTS/vozes_sync/Rosana/9.1/rf_selecionadas/wav16/rf_selecionadas1279.wav|diálogo com erros em relação ao ano anterior .|rosana|a_pool
/l/disk1/awstebas/data/TTS/vozes_sync/Rosana/9.1/rf_selecionadas/wav16/rf_selecionadas0131.wav|o grupo imobiliário mandou rebocar o ônibus .|rosana|a_pool
/l/disk1/awstebas/data/TTS/vozes_sync/Rosana/9.1/rf_selecionadas/wav16/rf_selecionadas1669.wav|pagou a cirurgia com cheque sem fundo .|rosana|a_pool
/l/disk1/awstebas/data/TTS/vozes_sync/Rosana/9.1/rf_selecionadas/wav16/rf_selecionadas0956.wav|em estado grave , foram afastados .|rosana|a_pool
/l/disk1/awstebas/data/TTS/vozes_sync/Rosana/9.1/rf_selecionadas/wav16/rf_selecionadas1733.wav|a pena acaba dependendo do tipo de vítimas .|rosana|a_pool
/l/disk1/awstebas/data/TTS/vozes_sync/Rosana/9.1/rf_selecionadas/wav16/rf_selecionadas0792.wav|defensor de ronaldinho continua sendo fundamental .|rosana|a_pool
/l/disk1/awstebas/data/TTS/vozes_sync/Rosana/9.1/rf_selecionadas/wav16/rf_selecionadas1297.wav|veja se a caixa inclui a bula original .|rosana|a_pool
/l/disk1/awstebas/data/TTS/vozes_sync/Rosana/9.1/rf_selecionadas/wav16/rf_selecionadas1883.wav|as chuvas destelharam várias casas na região sudeste .|rosana|a_pool
/l/disk1/awstebas/data/TTS/vozes_sync/Rosana/9.1/riqueza_fonetica/wav16/riqueza_fonetica0399.wav|um projeto vai analisar o impacto da tecnologia em zonas rurais .|rosana|a_pool
/l/disk1/awstebas/data/TTS/vozes_sync/Rosana/9.1/riqueza_fonetica/wav16/riqueza_fonetica0402.wav|a aplicação da droga em jejum pode provocar enjôo no paciente .|rosana|a_pool
/l/disk1/awstebas/data/TTS/vozes_sync/Rosana/9.1/rf_selecionadas/wav16/rf_selecionadas1194.wav|alguns dos membros também não queriam estar por aí .|rosana|a_pool
/l/disk1/awstebas/data/TTS/vozes_sync/Rosana/9.1/riqueza_fonetica/wav16/riqueza_fonetica0160.wav|a venda das ações não teve nenhuma ligação com a crise da coréia .|rosana|a_pool
/l/disk1/awstebas/data/TTS/vozes_sync/Rosana/9.1/rf_selecionadas/wav16/rf_selecionadas0272.wav|a meta do clube no trimestre .|rosana|a_pool
/l/disk1/awstebas/data/TTS/vozes_sync/Rosana/9.1/riqueza_fonetica/wav16/riqueza_fonetica0485.wav|nem todo o dinheiro é investido no país .|rosana|a_pool
/l/disk1/awstebas/data/TTS/vozes_sync/Rosana/9.1/riqueza_fonetica/wav16/riqueza_fonetica0170.wav|os associados devem comparecer para retirar uma cópia da liminar .|rosana|a_pool
/l/disk1/awstebas/data/TTS/vozes_sync/Rosana/9.1/rf_selecionadas/wav16/rf_selecionadas0865.wav|a movimentação das grandes privatizações e assim por diante .|rosana|a_pool
/l/disk1/awstebas/data/TTS/vozes_sync/Rosana/9.1/rf_selecionadas/wav16/rf_selecionadas1500.wav|gil vai se virar na nova rede sustentabilidade .|rosana|a_pool
/l/disk1/awstebas/data/TTS/vozes_sync/Rosana/9.1/riqueza_fonetica/wav16/riqueza_fonetica0050.wav|freqüentemente acontecem acidentes com vítimas na rodovia anhangüera .|rosana|a_pool
/l/disk1/awstebas/data/TTS/vozes_sync/Rosana/9.1/rf_selecionadas/wav16/rf_selecionadas0386.wav|dos contratos de aluguel , você anunciou o fato na emissora .|rosana|a_pool
/l/disk1/awstebas/data/TTS/vozes_sync/Rosana/9.1/rf_selecionadas/wav16/rf_selecionadas1521.wav|aqui eu tenho acesso a modernas técnicas de gerenciamento .|rosana|a_pool
/l/disk1/awstebas/data/TTS/vozes_sync/Rosana/9.1/rf_selecionadas/wav16/rf_selecionadas0237.wav|balanço de quinta pelo jornalista fernando rodrigues .|rosana|a_pool
/l/disk1/awstebas/data/TTS/vozes_sync/Rosana/9.1/rf_selecionadas/wav16/rf_selecionadas0867.wav|em nome do nosso país voto a favor da abertura na lei .|rosana|a_pool
/l/disk1/awstebas/data/TTS/vozes_sync/Rosana/9.1/riqueza_fonetica/wav16/riqueza_fonetica0108.wav|a banda cheiro de amor se apresentou ontem no ginásio municipal .|rosana|a_pool
/l/disk1/awstebas/data/TTS/vozes_sync/Rosana/9.1/rf_selecionadas/wav16/rf_selecionadas0855.wav|se eu fosse o executivo daquelas agências de notícias .|rosana|a_pool
/l/disk1/awstebas/data/TTS/vozes_sync/Rosana/9.1/rf_selecionadas/wav16/rf_selecionadas1530.wav|a chama é aplicada em sessões para evitar bolhas .|rosana|a_pool
/l/disk1/awstebas/data/TTS/vozes_sync/Rosana/9.1/rf_selecionadas/wav16/rf_selecionadas0291.wav|o ministro joaquim barbosa impetrou embargos infringentes , diz o documento .|rosana|a_pool
/l/disk1/awstebas/data/TTS/vozes_sync/Rosana/9.1/rf_selecionadas/wav16/rf_selecionadas1519.wav|os jovens que pedem uma vaga .|rosana|a_pool
/l/disk1/awstebas/data/TTS/vozes_sync/Rosana/9.1/rf_selecionadas/wav16/rf_selecionadas0028.wav|ameaça é enviada à ó a b .|rosana|a_pool
/l/disk1/awstebas/data/TTS/vozes_sync/Rosana/9.1/rf_selecionadas/wav16/rf_selecionadas0163.wav|e de alguns ex-aliados que sofreram análise da equipe .|rosana|a_pool
/l/disk1/awstebas/data/TTS/vozes_sync/Rosana/9.1/rf_selecionadas/wav16/rf_selecionadas0617.wav|as regras foram novamente alteradas com a bola em jogo .|rosana|a_pool
/l/disk1/awstebas/data/TTS/vozes_sync/Rosana/9.1/rf_selecionadas/wav16/rf_selecionadas1550.wav|assim que o museu voltar a funcionar , irá com sua família .|rosana|a_pool
/l/disk1/awstebas/data/TTS/vozes_sync/Rosana/9.1/rf_selecionadas/wav16/rf_selecionadas0023.wav|acharam o morto na sala dos blogueiros .|rosana|a_pool
/l/disk1/awstebas/data/TTS/vozes_sync/Rosana/9.1/rf_selecionadas/wav16/rf_selecionadas0533.wav|um bom conhecimento sobre como o barcelona marcou gol e abriu o placar .|rosana|a_pool
/l/disk1/awstebas/data/TTS/vozes_sync/Rosana/9.1/rf_selecionadas/wav16/rf_selecionadas0110.wav|a pm em crise , arrancaram sangue dela .|rosana|a_pool
/l/disk1/awstebas/data/TTS/vozes_sync/Rosana/9.1/rf_selecionadas/wav16/rf_selecionadas1053.wav|formados pela universidade de washington , predominam na zona oeste .|rosana|a_pool
/l/disk1/awstebas/data/TTS/vozes_sync/Rosana/9.1/riqueza_fonetica/wav16/riqueza_fonetica0434.wav|cartas e bilhetes escondidos revelam preciosidades sobre a vida do escritor .|rosana|a_pool
/l/disk1/awstebas/data/TTS/vozes_sync/Rosana/9.1/rf_selecionadas/wav16/rf_selecionadas0936.wav|miguel sabia de homicídios na barra da tijuca .|rosana|a_pool
/l/disk1/awstebas/data/TTS/vozes_sync/Rosana/9.1/riqueza_fonetica/wav16/riqueza_fonetica0121.wav|além de ser chefe de segurança do hotel , ele é também gerente .|rosana|a_pool
/l/disk1/awstebas/data/TTS/vozes_sync/Rosana/9.1/rf_selecionadas/wav16/rf_selecionadas1117.wav|estamos independentes e queremos um estado .|rosana|a_pool
/l/disk1/awstebas/data/TTS/vozes_sync/Rosana/9.1/rf_selecionadas/wav16/rf_selecionadas1606.wav|ibge fala de quantidade de homens na saúde .|rosana|a_pool
/l/disk1/awstebas/data/TTS/vozes_sync/Rosana/9.1/rf_selecionadas/wav16/rf_selecionadas1612.wav|do complexo da maré , o confronto já assusta os vizinhos .|rosana|a_pool
/l/disk1/awstebas/data/TTS/vozes_sync/Rosana/9.1/riqueza_fonetica/wav16/riqueza_fonetica0387.wav|será necessário chamar um guincho para rebocar o ônibus .|rosana|a_pool
/l/disk1/awstebas/data/TTS/vozes_sync/Rosana/9.1/rf_selecionadas/wav16/rf_selecionadas0524.wav|ser mulher em um carro no meio da rua .|rosana|a_pool
/l/disk1/awstebas/data/TTS/vozes_sync/Rosana/9.1/rf_selecionadas/wav16/rf_selecionadas0192.wav|o francês com o custo de um celular .|rosana|a_pool
/l/disk1/awstebas/data/TTS/vozes_sync/Rosana/9.1/rf_selecionadas/wav16/rf_selecionadas1345.wav|começam a vencer na disputa municipal .|rosana|a_pool
/l/disk1/awstebas/data/TTS/vozes_sync/Rosana/9.1/rf_selecionadas/wav16/rf_selecionadas1335.wav|os biólogos esconderam o ancestral da espécie na áustria .|rosana|a_pool
/l/disk1/awstebas/data/TTS/vozes_sync/Rosana/9.1/rf_selecionadas/wav16/rf_selecionadas1039.wav|para o caso , chamou a bancada do paulo maluf .|rosana|a_pool
/l/disk1/awstebas/data/TTS/vozes_sync/Rosana/9.1/rf_selecionadas/wav16/rf_selecionadas1457.wav|alguém ainda vai provar que acordar cedo não faz bem à saúde .|rosana|a_pool
/l/disk1/awstebas/data/TTS/vozes_sync/Rosana/9.1/rf_selecionadas/wav16/rf_selecionadas0888.wav|as urnas serão o melhor da retirada dos votos válidos .|rosana|a_pool
/l/disk1/awstebas/data/TTS/vozes_sync/Rosana/9.1/riqueza_fonetica/wav16/riqueza_fonetica0512.wav|pode vir buscar seu carro , pois ele já está pronto .|rosana|a_pool
/l/disk1/awstebas/data/TTS/vozes_sync/Rosana/9.1/rf_selecionadas/wav16/rf_selecionadas0004.wav|líder do pmdb na câmara vota pela corrupção .|rosana|a_pool
/l/disk1/awstebas/data/TTS/vozes_sync/Rosana/9.1/rf_selecionadas/wav16/rf_selecionadas0551.wav|fui para o hotel , comi um nhoque à bolonhesa e dormi .|rosana|a_pool
/l/disk1/awstebas/data/TTS/vozes_sync/Rosana/9.1/rf_selecionadas/wav16/rf_selecionadas1142.wav|é preciso estar melhor preparado para vencer a maratona .|rosana|a_pool
/l/disk1/awstebas/data/TTS/vozes_sync/Rosana/9.1/rf_selecionadas/wav16/rf_selecionadas1267.wav|a inflação eventual sofre a invasão de juros .|rosana|a_pool
/l/disk1/awstebas/data/TTS/vozes_sync/Rosana/9.1/rf_selecionadas/wav16/rf_selecionadas0540.wav|habitantes são obrigados a ter uma vida com renda fixa .|rosana|a_pool
/l/disk1/awstebas/data/TTS/vozes_sync/Rosana/9.1/riqueza_fonetica/wav16/riqueza_fonetica0091.wav|o ponto de partida é semelhante mas as conclusões são diferentes .|rosana|a_pool
/l/disk1/awstebas/data/TTS/vozes_sync/Rosana/9.1/rf_selecionadas/wav16/rf_selecionadas0351.wav|alunos de guarulhos são a favor do goleiro rogério .|rosana|a_pool
/l/disk1/awstebas/data/TTS/vozes_sync/Rosana/9.1/rf_selecionadas/wav16/rf_selecionadas1098.wav|para responder a essa pergunta , preciso de apenas um minuto .|rosana|a_pool
/l/disk1/awstebas/data/TTS/vozes_sync/Rosana/9.1/rf_selecionadas/wav16/rf_selecionadas1554.wav|chove forte em toda a baixada fluminense .|rosana|a_pool
/l/disk1/awstebas/data/TTS/vozes_sync/Rosana/9.1/riqueza_fonetica/wav16/riqueza_fonetica0033.wav|o seqüestrador foi reconhecido no balcão de uma companhia aérea .|rosana|a_pool
/l/disk1/awstebas/data/TTS/vozes_sync/Rosana/9.1/rf_selecionadas/wav16/rf_selecionadas0819.wav|momento em que revelou a guerra dos estranhos .|rosana|a_pool
/l/disk1/awstebas/data/TTS/vozes_sync/Rosana/9.1/rf_selecionadas/wav16/rf_selecionadas1227.wav|jogos olímpicos de londres já têm novo dirigente .|rosana|a_pool
/l/disk1/awstebas/data/TTS/vozes_sync/Rosana/9.1/riqueza_fonetica/wav16/riqueza_fonetica0072.wav|mas é o bom humor que mantém as pessoas em forma .|rosana|a_pool
